{
  "agent": "duplicate_agent",
  "version": "1.0.0",
  "summary": {
    "P0": 0,
    "P1": 2,
    "P2": 2,
    "total": 4
  },
  "records": [
    {
      "row_index": 2,
      "paper_id": "P002",
      "sample_id": "",
      "field": "paper_id+sample_name",
      "value": "",
      "risk_level": "P1",
      "reason": "同一论文中 sample_name 重复",
      "required_action": "检查是否为同一样本、不同倍率/循环数，或真实重复记录"
    },
    {
      "row_index": 3,
      "paper_id": "P002",
      "sample_id": "",
      "field": "paper_id+sample_name",
      "value": "",
      "risk_level": "P1",
      "reason": "同一论文中 sample_name 重复",
      "required_action": "检查是否为同一样本、不同倍率/循环数，或真实重复记录"
    },
    {
      "row_index": 2,
      "paper_id": "P002",
      "sample_id": "",
      "field": "near_duplicate_values",
      "value": "",
      "risk_level": "P2",
      "reason": "关键描述符和性能值近似重复",
      "required_action": "确认是否为复制残留或同一材料重复记录"
    },
    {
      "row_index": 3,
      "paper_id": "P002",
      "sample_id": "",
      "field": "near_duplicate_values",
      "value": "",
      "risk_level": "P2",
      "reason": "关键描述符和性能值近似重复",
      "required_action": "确认是否为复制残留或同一材料重复记录"
    }
  ]
}