{
  "agent": "physics_agent",
  "version": "1.0.0",
  "summary": {
    "P0": 2,
    "P1": 4,
    "P2": 3,
    "total": 9
  },
  "records": [
    {
      "row_index": 1,
      "paper_id": "P001",
      "sample_id": "",
      "field": "BET_m2_g",
      "value": 12300.0,
      "risk_level": "P0",
      "reason": "BET_m2_g = 12300 m2/g above hard maximum 10000",
      "required_action": "回查原文或 SI；优先检查 OCR 小数点、单位和百分号"
    },
    {
      "row_index": 1,
      "paper_id": "P001",
      "sample_id": "",
      "field": "ICE_pct",
      "value": 105.0,
      "risk_level": "P0",
      "reason": "ICE_pct = 105 % above hard maximum 100",
      "required_action": "回查原文或 SI；优先检查 OCR 小数点、单位和百分号"
    },
    {
      "row_index": 2,
      "paper_id": "P002",
      "sample_id": "",
      "field": "ID_IG",
      "value": 4.2,
      "risk_level": "P1",
      "reason": "ID_IG = 4.2  above typical range 3.5",
      "required_action": "建议回查原文；优先检查单位、小数点和表格行错位"
    },
    {
      "row_index": 2,
      "paper_id": "P002",
      "sample_id": "",
      "field": "pore_volume_cm3_g",
      "value": 6.5,
      "risk_level": "P1",
      "reason": "pore_volume_cm3_g = 6.5 cm3/g above typical range 5",
      "required_action": "建议回查原文；优先检查单位、小数点和表格行错位"
    },
    {
      "row_index": 2,
      "paper_id": "P002",
      "sample_id": "",
      "field": "mass_loading_mg_cm2",
      "value": "",
      "risk_level": "P2",
      "reason": "缺少 mass_loading_mg_cm2，影响器件级可比性",
      "required_action": "回查实验方法或电极制备部分"
    },
    {
      "row_index": 3,
      "paper_id": "P002",
      "sample_id": "",
      "field": "ID_IG",
      "value": 4.2,
      "risk_level": "P1",
      "reason": "ID_IG = 4.2  above typical range 3.5",
      "required_action": "建议回查原文；优先检查单位、小数点和表格行错位"
    },
    {
      "row_index": 3,
      "paper_id": "P002",
      "sample_id": "",
      "field": "pore_volume_cm3_g",
      "value": 6.5,
      "risk_level": "P1",
      "reason": "pore_volume_cm3_g = 6.5 cm3/g above typical range 5",
      "required_action": "建议回查原文；优先检查单位、小数点和表格行错位"
    },
    {
      "row_index": 3,
      "paper_id": "P002",
      "sample_id": "",
      "field": "mass_loading_mg_cm2",
      "value": "",
      "risk_level": "P2",
      "reason": "缺少 mass_loading_mg_cm2，影响器件级可比性",
      "required_action": "回查实验方法或电极制备部分"
    },
    {
      "row_index": 4,
      "paper_id": "P003",
      "sample_id": "",
      "field": "source_location",
      "value": "",
      "risk_level": "P2",
      "reason": "缺少来源位置，后续难以回查",
      "required_action": "补充表号、图号、SI 页码或原文位置"
    }
  ]
}